Sheet: Sheet1
A4: Number of Nodes | B4: Burst Size (Byte) | C4: DataRate (KB/s) | D4: Time to Clear
A5: 4 | B5: 512 | C5: 512 | D5: 0.012076
A6: 4 | B6: 1024 | C6: 512 | D6: 0.015409
A7: 4 | B7: 2048 | C7: 512 | D7: 0.022138
A8: 4 | B8: 4096 | C8: 512 | D8: 0.03532
A9: 4 | B9: 8192 | C9: 512 | D9: 0.062317
A10: 4 | B10: 16384 | C10: 512 | D10: 0.113398
A11: 4 | B11: 32768 | C11: 512 | D11: 0.21869
A12: 8 | B12: 512 | C12: 512 | D12: 0.024261
A13: 8 | B13: 1024 | C13: 512 | D13: 0.030618
A14: 8 | B14: 2048 | C14: 512 | D14: 0.044434
A15: 8 | B15: 4096 | C15: 512 | D15: 0.070162
A16: 8 | B16: 8192 | C16: 512 | D16: 0.122829
A17: 8 | B17: 16384 | C17: 512 | D17: 0.227237
A18: 8 | B18: 32768 | C18: 512 | D18: 0.436387
A19: 8 | B19: 32768 | C19: 1024 | D19: 0.436386
A20: 8 | B20: 32768 | C20: 2048 | D20: 0.436836
A21: 4 | B21: 32768 | C21: 1024 | D21: 0.218689
A22: 4 | B22: 32768 | C22: 2048 | D22: 0.218689

Sheet: throughput on-off
A1: Throughput: on/off application, every node broadcast
A3: Nodes | B3: Packet size (Byte) | C3: Rate (KB/s) | D3: Packets rcvd | E3: Time(s) | F3: Total Kbits Sent (attempt) | G3: Total Kbits Recv | H3: Throughput (KB/s)
A4: 4 | B4: 512 | C4: 500 | D4: 3398 | E4: 10.202891 | F4: of:=[.A4]*[.C4]*9 -> 18000 | G4: of:=[.B4]*[.D4]*8/1000 -> 13918.208 | H4: of:=[.G4]/[.E4] -> 1364.14355499828
A5: 4 | B5: 1024 | C5: 500 | D5: 2196 | E5: 8.990082 | F5: of:=[.A5]*[.C5]*9 -> 18000 | G5: of:=[.B5]*[.D5]*8/1000 -> 17989.632 | H5: of:=[.G5]/[.E5] -> 2001.05316058296
A6: 4 | B6: 2048 | C6: 500 | D6: 1096 | E6: 8.967895 | F6: of:=[.A6]*[.C6]*9 -> 18000 | G6: of:=[.B6]*[.D6]*8/1000 -> 17956.864 | H6: of:=[.G6]/[.E6] -> 2002.34993830771
A7: 4 | B7: 4096 | C7: 500 | D7: 548 | E7: 8.948002 | F7: of:=[.A7]*[.C7]*9 -> 18000 | G7: of:=[.B7]*[.D7]*8/1000 -> 17956.864 | H7: of:=[.G7]/[.E7] -> 2006.80151837248
A8: 4 | B8: 4096 | C8: 600 | D8: 656 | E8: 8.937508 | F8: of:=[.A8]*[.C8]*9 -> 21600 | G8: of:=[.B8]*[.D8]*8/1000 -> 21495.808 | H8: of:=[.G8]/[.E8] -> 2405.12321779181
A9: 4 | B9: 4096 | C9: 700 | D9: 768 | E9: 8.976494 | F9: of:=[.A9]*[.C9]*9 -> 25200 | G9: of:=[.B9]*[.D9]*8/1000 -> 25165.824 | H9: of:=[.G9]/[.E9] -> 2803.52485057083
A10: 4 | B10: 4096 | C10: 800 | D10: 876 | E10: 8.964757 | F10: of:=[.A10]*[.C10]*9 -> 28800 | G10: of:=[.B10]*[.D10]*8/1000 -> 28704.768 | H10: of:=[.G10]/[.E10] -> 3201.9571751917
A11: 4 | B11: 4096 | C11: 900 | D11: 988 | E11: 8.998097 | F11: of:=[.A11]*[.C11]*9 -> 32400 | G11: of:=[.B11]*[.D11]*8/1000 -> 32374.784 | H11: of:=[.G11]/[.E11] -> 3597.95899066214
A12: 8 | B12: 512 | C12: 500 | D12: 3853 | E12: 11.373886 | F12: of:=[.A12]*[.C12]*9 -> 36000 | G12: of:=[.B12]*[.D12]*8/1000 -> 15781.888 | H12: of:=[.G12]/[.E12] -> 1387.55461413979
A13: 16 | B13: 512 | C13: 500 | D13: 4691 | E13: 13.713855 | F13: of:=[.A13]*[.C13]*9 -> 72000 | G13: of:=[.B13]*[.D13]*8/1000 -> 19214.336 | H13: of:=[.G13]/[.E13] -> 1401.0893362953
A14: 32 | B14: 512 | C14: 500 | D14: 6314 | E14: 18.363712 | F14: of:=[.A14]*[.C14]*9 -> 144000 | G14: of:=[.B14]*[.D14]*8/1000 -> 25862.144 | H14: of:=[.G14]/[.E14] -> 1408.32877361614
A15: 8 | B15: 1024 | C15: 500 | D15: 3187 | E15: 12.021639 | F15: of:=[.A15]*[.C15]*9 -> 36000 | G15: of:=[.B15]*[.D15]*8/1000 -> 26107.904 | H15: of:=[.G15]/[.E15] -> 2171.74247205393
A16: 16 | B16: 1024 | C16: 500 | D16: 4013 | E16: 15.024264 | F16: of:=[.A16]*[.C16]*9 -> 72000 | G16: of:=[.B16]*[.D16]*8/1000 -> 32874.496 | H16: of:=[.G16]/[.E16] -> 2188.09360644887
A17: 32 | B17: 1024 | C17: 500 | D17: 5603 | E17: 20.894377 | F17: of:=[.A17]*[.C17]*9 -> 144000 | G17: of:=[.B17]*[.D17]*8/1000 -> 45899.776 | H17: of:=[.G17]/[.E17] -> 2196.752552134
A18: 8 | B18: 2048 | C18: 500 | D18: 2192 | E18: 11.854251 | F18: of:=[.A18]*[.C18]*9 -> 36000 | G18: of:=[.B18]*[.D18]*8/1000 -> 35913.728 | H18: of:=[.G18]/[.E18] -> 3029.60752222979
A19: 16 | B19: 2048 | C19: 500 | D19: 3271 | E19: 17.610077 | F19: of:=[.A19]*[.C19]*9 -> 72000 | G19: of:=[.B19]*[.D19]*8/1000 -> 53592.064 | H19: of:=[.G19]/[.E19] -> 3043.26119641612
A20: 32 | B20: 2048 | C20: 500 | D20: 4747 | E20: 25.446473 | F20: of:=[.A20]*[.C20]*9 -> 144000 | G20: of:=[.B20]*[.D20]*8/1000 -> 77774.848 | H20: of:=[.G20]/[.E20] -> 3056.40974291408
A21: 8 | B21: 4096 | C21: 500 | D21: 1096 | E21: 9.532683 | F21: of:=[.A21]*[.C21]*9 -> 36000 | G21: of:=[.B21]*[.D21]*8/1000 -> 35913.728 | H21: of:=[.G21]/[.E21] -> 3767.43126777634
A22: 16 | B22: 4096 | C22: 500 | D22: 2146 | E22: 18.535341 | F22: of:=[.A22]*[.C22]*9 -> 72000 | G22: of:=[.B22]*[.D22]*8/1000 -> 70320.128 | H22: of:=[.G22]/[.E22] -> 3793.84053414502
A23: 32 | B23: 4096 | C23: 500 | D23: 3748 | E23: 32.235189 | F23: of:=[.A23]*[.C23]*9 -> 144000 | G23: of:=[.B23]*[.D23]*8/1000 -> 122814.464 | H23: of:=[.G23]/[.E23] -> 3809.95017587767
A24: 8 | B24: 512 | C24: 600 | D24: 3854 | E24: 11.38399 | F24: of:=[.A24]*[.C24]*9 -> 43200 | G24: of:=[.B24]*[.D24]*8/1000 -> 15785.984 | H24: of:=[.G24]/[.E24] -> 1386.68287656612
A25: 8 | B25: 512 | C25: 700 | D25: 3854 | E25: 11.37817 | F25: of:=[.A25]*[.C25]*9 -> 50400 | G25: of:=[.B25]*[.D25]*8/1000 -> 15785.984 | H25: of:=[.G25]/[.E25] -> 1387.39217290654
A26: 8 | B26: 512 | C26: 800 | D26: 3855 | E26: 11.380673 | F26: of:=[.A26]*[.C26]*9 -> 57600 | G26: of:=[.B26]*[.D26]*8/1000 -> 15790.08 | H26: of:=[.G26]/[.E26] -> 1387.44694623947
A27: 8 | B27: 512 | C27: 800 | D27: 3859 | E27: 11.390723 | F27: of:=[.A27]*[.C27]*9 -> 57600 | G27: of:=[.B27]*[.D27]*8/1000 -> 15806.464 | H27: of:=[.G27]/[.E27] -> 1387.66116953243
A28: 8 | B28: 1024 | C28: 600 | D28: 3191 | E28: 12.035641 | F28: of:=[.A28]*[.C28]*9 -> 43200 | G28: of:=[.B28]*[.D28]*8/1000 -> 26140.672 | H28: of:=[.G28]/[.E28] -> 2171.93849500828
A29: 8 | B29: 1024 | C29: 700 | D29: 3191 | E29: 12.030295 | F29: of:=[.A29]*[.C29]*9 -> 50400 | G29: of:=[.B29]*[.D29]*8/1000 -> 26140.672 | H29: of:=[.G29]/[.E29] -> 2172.90365697599
A30: 8 | B30: 1024 | C30: 800 | D30: 3190 | E30: 12.037999 | F30: of:=[.A30]*[.C30]*9 -> 57600 | G30: of:=[.B30]*[.D30]*8/1000 -> 26132.48 | H30: of:=[.G30]/[.E30] -> 2170.83254451176
A31: 8 | B31: 1024 | C31: 800 | D31: 3195 | E31: 12.052271 | F31: of:=[.A31]*[.C31]*9 -> 57600 | G31: of:=[.B31]*[.D31]*8/1000 -> 26173.44 | H31: of:=[.G31]/[.E31] -> 2171.6604281467
A32: 8 | B32: 2048 | C32: 600 | D32: 2449 | E32: 13.256069 | F32: of:=[.A32]*[.C32]*9 -> 43200 | G32: of:=[.B32]*[.D32]*8/1000 -> 40124.416 | H32: of:=[.G32]/[.E32] -> 3026.87139000257
A33: 8 | B33: 2048 | C33: 700 | D33: 2463 | E33: 13.332938 | F33: of:=[.A33]*[.C33]*9 -> 50400 | G33: of:=[.B33]*[.D33]*8/1000 -> 40353.792 | H33: of:=[.G33]/[.E33] -> 3026.62413940573
A34: 8 | B34: 2048 | C34: 800 | D34: 2464 | E34: 13.332561 | F34: of:=[.A34]*[.C34]*9 -> 57600 | G34: of:=[.B34]*[.D34]*8/1000 -> 40370.176 | H34: of:=[.G34]/[.E34] -> 3027.93859334302
A35: 8 | B35: 2048 | C35: 800 | D35: 2471 | E35: 13.373014 | F35: of:=[.A35]*[.C35]*9 -> 57600 | G35: of:=[.B35]*[.D35]*8/1000 -> 40484.864 | H35: of:=[.G35]/[.E35] -> 3027.35523943967
A36: 8 | B36: 4096 | C36: 600 | D36: 1311 | E36: 11.396326 | F36: of:=[.A36]*[.C36]*9 -> 43200 | G36: of:=[.B36]*[.D36]*8/1000 -> 42958.848 | H36: of:=[.G36]/[.E36] -> 3769.53484833621
A37: 8 | B37: 4096 | C37: 700 | D37: 1536 | E37: 13.346554 | F37: of:=[.A37]*[.C37]*9 -> 50400 | G37: of:=[.B37]*[.D37]*8/1000 -> 50331.648 | H37: of:=[.G37]/[.E37] -> 3771.13433175335
A38: 8 | B38: 4096 | C38: 800 | D38: 1744 | E38: 15.15541 | F38: of:=[.A38]*[.C38]*9 -> 57600 | G38: of:=[.B38]*[.D38]*8/1000 -> 57147.392 | H38: of:=[.G38]/[.E38] -> 3770.75856080436
A39: 8 | B39: 4096 | C39: 800 | D39: 1843 | E39: 16.015125 | F39: of:=[.A39]*[.C39]*9 -> 57600 | G39: of:=[.B39]*[.D39]*8/1000 -> 60391.424 | H39: of:=[.G39]/[.E39] -> 3770.89932173492